{
  "astVersion": "2.1",
  "sourceVersion": "2.0",
  "kind": "FlowDocument",
  "imports": [
    {
      "type": "ModuleImport",
      "name": "docker",
      "version": "1.0"
    },
    {
      "type": "ModuleImport",
      "name": "git",
      "version": "1.0"
    }
  ],
  "flow": {
    "type": "Flow",
    "name": "checkout-build-image",
    "input": [
      {
        "type": "Input",
        "name": "version",
        "valueType": {
          "kind": "text",
          "values": []
        },
        "required": true
      }
    ],
    "vars": [],
    "systems": [
      {
        "type": "System",
        "name": "source",
        "systemType": "git",
        "purpose": "Public application source repository",
        "config": {}
      },
      {
        "type": "System",
        "name": "registry",
        "systemType": "docker",
        "purpose": "Local image build target without registry push",
        "config": {}
      }
    ],
    "triggers": [],
    "controlRequirements": [],
    "controlEvidence": [],
    "controlDecision": {
      "status": "ALLOWED",
      "blockingRequirementIds": [],
      "pendingRequirementIds": []
    },
    "topologyRequirements": [
      {
        "id": "topology.workflowLifetime.build-reference-image",
        "kind": "WORKFLOW_LIFETIME",
        "subject": "build-reference-image",
        "source": "CANONICAL_WORKFLOW",
        "evidenceReference": "intent.workflows.build-reference-image"
      },
      {
        "id": "topology.workflowScope.build-reference-image",
        "kind": "WORKFLOW_SCOPE",
        "subject": "build-reference-image",
        "source": "CANONICAL_WORKFLOW",
        "evidenceReference": "intent.workflows.build-reference-image"
      }
    ],
    "steps": [
      {
        "type": "Action",
        "module": "git",
        "action": "checkout",
        "target": {
          "type": "Reference",
          "path": [
            "source"
          ],
          "safe": false,
          "scope": "auto"
        },
        "params": {
          "branch": {
            "type": "StringLiteral",
            "value": "main"
          },
          "url": {
            "type": "StringLiteral",
            "value": "https://github.com/octocat/Hello-World.git"
          }
        },
        "result": {
          "type": "ResultBinding",
          "name": "checkout"
        },
        "semanticCapability": "CHECKOUT",
        "semanticEffects": [
          {
            "domain": "SOFTWARE_DELIVERY",
            "operation": "READ",
            "resource": "source.repository",
            "external": true,
            "sourceCapability": "CHECKOUT"
          }
        ],
        "sourceId": "checkout",
        "bindingMetadata": {
          "system": {
            "type": "StringLiteral",
            "value": "source"
          }
        },
        "declaredOutputs": [],
        "dependsOn": []
      },
      {
        "type": "Action",
        "module": "docker",
        "action": "build",
        "target": {
          "type": "Reference",
          "path": [
            "registry"
          ],
          "safe": false,
          "scope": "auto"
        },
        "params": {
          "image": {
            "type": "TemplateString",
            "parts": [
              {
                "type": "StringLiteral",
                "value": "ghcr.io/flowlang/reference:"
              },
              {
                "type": "Reference",
                "path": [
                  "version"
                ],
                "safe": false,
                "scope": "auto",
                "location": {
                  "line": 1,
                  "column": 1
                }
              }
            ],
            "sensitive": false
          },
          "path": {
            "type": "StringLiteral",
            "value": "."
          },
          "push": {
            "type": "BooleanLiteral",
            "value": false
          }
        },
        "result": {
          "type": "ResultBinding",
          "name": "build_image"
        },
        "semanticCapability": "BUILD_IMAGE",
        "semanticEffects": [
          {
            "domain": "SOFTWARE_DELIVERY",
            "operation": "CREATE",
            "resource": "software.image",
            "transition": {
              "from": "ABSENT",
              "to": "PRESENT"
            },
            "external": true,
            "sourceCapability": "BUILD_IMAGE"
          }
        ],
        "sourceId": "build-image",
        "bindingMetadata": {
          "system": {
            "type": "StringLiteral",
            "value": "registry"
          }
        },
        "declaredOutputs": [],
        "dependsOn": [
          "checkout"
        ]
      }
    ]
  },
  "metadata": {
    "createdBy": "intent-to-ast-planner",
    "generatedByAI": false,
    "sourceIntent": {
      "description": "Target-scoped reference intent proving ordered native checkout and image build projection.",
      "workflows": [
        {
          "name": "build-reference-image",
          "kind": "BUILD",
          "stepIds": [
            "checkout",
            "build-image"
          ]
        }
      ],
      "policies": [],
      "systems": [
        {
          "name": "source",
          "sourceType": "git",
          "canonicalType": "git",
          "purpose": "Public application source repository",
          "config": {}
        },
        {
          "name": "registry",
          "sourceType": "dockerRegistry",
          "canonicalType": "docker",
          "purpose": "Local image build target without registry push",
          "config": {}
        }
      ],
      "systemPurposes": {
        "source": "Public application source repository",
        "registry": "Local image build target without registry push"
      },
      "failure": {
        "notify": false,
        "rollback": false,
        "stopOnError": true
      },
      "fields": [
        {
          "identity": "failure/notify",
          "sourcePath": "$.failure.notify",
          "targetIdentity": "plan/source-intent/failure/notify",
          "disposition": "PRESERVED",
          "valueKind": "boolean",
          "sourceDigest": "b80d83f9e626e9c5e5aab1062e02b396d16d4a85fec72831c417c562fa440f95",
          "expectedTargetDigest": "b80d83f9e626e9c5e5aab1062e02b396d16d4a85fec72831c417c562fa440f95"
        },
        {
          "identity": "failure/rollback",
          "sourcePath": "$.failure.rollback",
          "targetIdentity": "plan/source-intent/failure/rollback",
          "disposition": "PRESERVED",
          "valueKind": "boolean",
          "sourceDigest": "b80d83f9e626e9c5e5aab1062e02b396d16d4a85fec72831c417c562fa440f95",
          "expectedTargetDigest": "b80d83f9e626e9c5e5aab1062e02b396d16d4a85fec72831c417c562fa440f95"
        },
        {
          "identity": "failure/stop-on-error",
          "sourcePath": "$.failure.stopOnError",
          "targetIdentity": "plan/source-intent/failure/stop-on-error",
          "disposition": "PRESERVED",
          "valueKind": "boolean",
          "sourceDigest": "916aded13399466a7d2c4c534fdd3cc7ed237a46a6524ef4a4dd8ccbef5ced67",
          "expectedTargetDigest": "916aded13399466a7d2c4c534fdd3cc7ed237a46a6524ef4a4dd8ccbef5ced67"
        },
        {
          "identity": "input/version/name",
          "sourcePath": "$.inputs[0].name",
          "targetIdentity": "plan/input/version/name",
          "disposition": "PRESERVED",
          "valueKind": "string",
          "sourceDigest": "2633508ce86497f6df5f9c7e1bb4e8c80b5149bd4cf2354f5fedbe8566aee4ae",
          "expectedTargetDigest": "2633508ce86497f6df5f9c7e1bb4e8c80b5149bd4cf2354f5fedbe8566aee4ae"
        },
        {
          "identity": "input/version/required",
          "sourcePath": "$.inputs[0].required",
          "targetIdentity": "plan/input/version/required",
          "disposition": "PRESERVED",
          "valueKind": "boolean",
          "sourceDigest": "916aded13399466a7d2c4c534fdd3cc7ed237a46a6524ef4a4dd8ccbef5ced67",
          "expectedTargetDigest": "916aded13399466a7d2c4c534fdd3cc7ed237a46a6524ef4a4dd8ccbef5ced67"
        },
        {
          "identity": "input/version/type",
          "sourcePath": "$.inputs[0].type",
          "targetIdentity": "plan/input/version/type",
          "disposition": "TRANSFORMED",
          "valueKind": "input-type",
          "sourceDigest": "b6739a545c8a404771fae7b9b219e0e6a8b2d4f437f85bcae0e4a4ed5bdc3fa2",
          "expectedTargetDigest": "38e10496b36f69c2e0a0d4da34d2468a358aa717e05201f5cbc6e8b207011723",
          "transform": "intent-input-type-normalization"
        },
        {
          "identity": "intent/description",
          "sourcePath": "$.description",
          "targetIdentity": "plan/source-intent/description",
          "disposition": "PRESERVED",
          "valueKind": "string",
          "sourceDigest": "e44ac00aa123376d60db58e1cb35ea36cd67488b11ee0511de51bf0c39f870ce",
          "expectedTargetDigest": "e44ac00aa123376d60db58e1cb35ea36cd67488b11ee0511de51bf0c39f870ce"
        },
        {
          "identity": "intent/name",
          "sourcePath": "$.name",
          "targetIdentity": "plan/flow/name",
          "disposition": "PRESERVED",
          "valueKind": "string",
          "sourceDigest": "8cd86fb64b0e5bfd0bf1d3a0c443418627f2b5f934d6e2ef9a85500b280b7cb2",
          "expectedTargetDigest": "8cd86fb64b0e5bfd0bf1d3a0c443418627f2b5f934d6e2ef9a85500b280b7cb2"
        },
        {
          "identity": "step/build-image/capability",
          "sourcePath": "$.workflows[0].steps[1].capability",
          "targetIdentity": "plan/node/source/build-image/semantic-capability",
          "disposition": "PRESERVED",
          "valueKind": "enum",
          "sourceDigest": "cbbb06206a7f5c594d687b21ec88a941a20587170fa9baa8bdebfdd60906a6c8",
          "expectedTargetDigest": "cbbb06206a7f5c594d687b21ec88a941a20587170fa9baa8bdebfdd60906a6c8"
        },
        {